{
  "$schema": "http://json-schema.org/draft-07/schema#",
  "type": "object",
  "properties": {
    "name": {
      "type": "string"
    },
    "description": {
      "type": "string"
    },
    "tagline": {
      "type": "string"
    },
    "author": {
      "type": "string"
    },
    "emails": {
      "type": "object",
      "properties": {
        "primary": {
          "type": "string"
        },
        "support": {
          "type": "string"
        }
      }
    },
    "urls": {
      "type": "object",
      "properties": {
        "website": {
          "type": "string"
        },
        "github": {
          "type": "string"
        },
        "twitter": {
          "type": "string"
        }
      },
      "required": []
    },
    "native": {
      "type": "object",
      "properties": {
        "name": {
          "type": "string"
        },
        "slug": {
          "type": "string"
        },
        "version": {
          "type": "string"
        },
        "scheme": {
          "type": "string"
        }
      },
      "required": ["name", "slug", "version", "scheme"]
    }
  },
  "required": [
    "name",
    "description",
    "tagline",
    "author",
    "emails",
    "urls",
    "native"
  ]
}
